{
  "schema_version": "1.0.0",
  "tenant_id": "00000000-0000-4000-8000-000000000001",
  "source_id": "10000000-0000-4000-8000-000000000001",
  "name": "Synthetic recorded replay",
  "kind": "recorded_replay",
  "status": "active",
  "config": {
    "format": "jsonl",
    "location_ref": "data/synthetic/demo-one.jsonl",
    "replay_speed": 10,
    "loop": false,
    "timezone": "UTC"
  },
  "created_at": "2026-08-01T00:00:00Z"
}
